{"capabilities":[{"id":"code.modify","mode":"exclusive"},{"id":"code.search","mode":"exclusive"},{"id":"code.test","mode":"additive"},{"id":"git.review","mode":"exclusive"},{"id":"web.research","mode":"exclusive"}],"lockId":"sha256:b857a3cd492f61d3239d48abb95ed9bedadaafa7454ef01564b6d2cf114e2b14","models":[{"id":"gpt-5","provider":"openai-codex","thinking":"medium","tier":"balanced"},{"id":"gpt-5","provider":"openai-codex","thinking":"high","tier":"deep"},{"id":"gpt-5-mini","provider":"openai-codex","thinking":"low","tier":"fast"}],"recipes":[{"budget":{"timeoutSeconds":300},"capabilities":{"optional":["code.test"],"required":["code.search","git.review"]},"id":"change-reviewer","modelTier":"fast","permissionProfile":"review","resourceIds":["policy.evidence","role.change-reviewer","role.repo-scout","system.worker-protocol"],"tools":["read","grep","find","ls","verify"],"workspaceMode":"isolated-readonly"},{"budget":{"timeoutSeconds":1800},"capabilities":{"optional":[],"required":["code.search","code.modify","code.test"]},"id":"implementation-worker","modelTier":"deep","permissionProfile":"modify-isolated","resourceIds":["policy.evidence","role.implementation-worker","role.repo-scout","system.worker-protocol"],"tools":["read","grep","find","ls","bash","edit","write","verify"],"workspaceMode":"isolated-worktree"},{"budget":{"timeoutSeconds":600},"capabilities":{"optional":[],"required":["code.search"]},"id":"repo-scout","modelTier":"fast","permissionProfile":"observe","resourceIds":["policy.evidence","role.repo-scout","system.worker-protocol"],"tools":["read","grep","find","ls"],"workspaceMode":"shared-readonly"},{"budget":{"timeoutSeconds":900},"capabilities":{"optional":[],"required":["web.research"]},"id":"web-researcher","modelTier":"balanced","permissionProfile":"research","resourceIds":["policy.evidence","role.web-researcher","system.worker-protocol"],"tools":["read","web"],"workspaceMode":"shared-readonly"}],"resources":[{"backends":["orca-pi","local-pi"],"conflicts":[],"credentialEnv":[],"id":"policy.evidence","kind":"prompt-template","path":"policies/evidence.md","permissions":["observe","research","modify-isolated","review"],"piCompatibility":">=0.84.0 <0.85.0","provides":[],"requires":[],"runtimeRisk":"none","sha256":"sha256:135bdf201fa8b067fb1f8f349f6402dd56a24b2b8a8c5ac6c14f67e22d449406","source":"catalog:policies/evidence.md","startupCost":"low","tools":[],"trust":"audited","version":"1.0.0"},{"backends":["orca-pi","local-pi"],"conflicts":[],"credentialEnv":[],"id":"role.change-reviewer","kind":"role","path":"roles/change-reviewer.md","permissions":["review"],"piCompatibility":">=0.84.0 <0.85.0","provides":["git.review"],"requires":["code.search","code.test"],"runtimeRisk":"none","sha256":"sha256:9a73454a28b2c10409b1b3e862de06f7a5254754d61bc8d86a681017535afe21","source":"catalog:roles/change-reviewer.md","startupCost":"low","tools":["read","grep","find","ls","verify"],"trust":"audited","version":"1.0.0"},{"backends":["orca-pi","local-pi"],"conflicts":[],"credentialEnv":[],"id":"role.implementation-worker","kind":"role","path":"roles/implementation-worker.md","permissions":["modify-isolated"],"piCompatibility":">=0.84.0 <0.85.0","provides":["code.modify","code.test"],"requires":["code.search"],"runtimeRisk":"filesystem","sha256":"sha256:725be5b2396176e8810f656026fec2367fb5e40fb41fa7eac80f63be4f6da11d","source":"catalog:roles/implementation-worker.md","startupCost":"medium","tools":["read","grep","find","ls","bash","edit","write","verify"],"trust":"audited","version":"1.0.0"},{"backends":["orca-pi","local-pi"],"conflicts":[],"credentialEnv":[],"id":"role.repo-scout","kind":"role","path":"roles/repo-scout.md","permissions":["observe","modify-isolated","review"],"piCompatibility":">=0.84.0 <0.85.0","provides":["code.search"],"requires":[],"runtimeRisk":"none","sha256":"sha256:d0652cacbecfb2681d9d5e2df6b279831e1cb448cfde495408e4597a30e20786","source":"catalog:roles/repo-scout.md","startupCost":"low","tools":["read","grep","find","ls"],"trust":"audited","version":"1.0.0"},{"backends":["orca-pi","local-pi"],"conflicts":[],"credentialEnv":[],"id":"role.web-researcher","kind":"role","path":"roles/web-researcher.md","permissions":["research"],"piCompatibility":">=0.84.0 <0.85.0","provides":["web.research"],"requires":[],"runtimeRisk":"network","sha256":"sha256:36e22ab1a47c2b8c610c6daa279bb94edb1cf7e7fee62ced1b3a138ce80cc666","source":"catalog:roles/web-researcher.md","startupCost":"medium","tools":["read","web"],"trust":"audited","version":"1.0.0"},{"backends":["orca-pi","local-pi"],"conflicts":[],"credentialEnv":[],"id":"system.worker-protocol","kind":"system-fragment","path":"prompts/worker-protocol.md","permissions":["observe","research","modify-isolated","review"],"piCompatibility":">=0.84.0 <0.85.0","provides":[],"requires":[],"runtimeRisk":"none","sha256":"sha256:94f29a4d5e01b63c000b5ffdef7dd5a724c4a95bacc0d7794bfd039275004845","source":"catalog:prompts/worker-protocol.md","startupCost":"low","tools":[],"trust":"audited","version":"1.0.0"}],"schemaVersion":1,"sourceHash":"sha256:ee446ddc961747df1b75a26c69b43ce72bc9d80b34f79262c730c61049407291"}